COMPANY_NAME,LOGO,FLEET_SIZE,REVIEW_ARTICLE,RATING,ENTERTAINMENT,IMAGES
Royal Caribbean,royal_logo.png,27,Adventure focused big ships,4.6,"Broadway shows, surf rider",royal_line.jpg
Norwegian Cruise Line,norwegian_logo.png,19,Freestyle modern cruising vibe,4.4,Live music theme nights,norwegian_line.jpg
Carnival Cruise Line,carnival_logo.png,24,Affordable fun family experience,4.2,Comedy club water parks,carnival_line.jpg
MSC Cruises,msc_logo.png,22,European style onboard service,4.3,Opera shows fine dining,msc_line.jpg
Celebrity Cruises,celebrity_logo.png,15,Modern luxury relaxed elegance,4.7,Art galleries wine tastings,celebrity_line.jpg
Princess Cruises,princess_logo.png,17,Classic cruising with strong itineraries,4.5,Theater shows enrichment programs,princess_line.jpg
Holland America Line,hal_logo.png,11,Premium traditional cruising,4.4,Live music culinary demos,hal_line.jpg
